{
  "id": "IDEA-011",
  "title": "AI Personas Framework für Agenten-Vielfalt",
  "description": "Ein Framework, das KI-Agenten ermöglicht, in unterschiedlichen Personas mit verschiedenen beruflichen Hintergründen, Alter, Geschlecht, Persönlichkeiten und Attitüden zu kommunizieren. Das System soll sicherstellen, dass Agenten mit unterschiedlichen Personas sich passend ergänzen und effektiv zusammenarbeiten können.",
  "status": "backlog",
  "priority": "high",
  "category": "development",
  "tags": [
    "ai-personas",
    "agenten",
    "vielfalt",
    "kollaboration",
    "persönlichkeit",
    "framework"
  ],
  "created_date": "2025-11-09T12:00:00Z",
  "updated_date": "2025-11-09T12:00:00Z",
  "estimated_effort": "2-3 weeks",
  "dependencies": [],
  "acceptance_criteria": [
    "Persona-Definitionssystem mit Beruf, Alter, Geschlecht, Persönlichkeitsmerkmalen",
    "Dynamische Persona-Zuweisung für KI-Agenten",
    "Kommunikationsstil-Adaption basierend auf Persona",
    "Kompatibilitätsmatrix für Persona-Zusammenarbeit",
    "Konfliktlösungsmechanismus für unterschiedliche Persona-Ansätze",
    "Persona-basiertes Rollenverteilungssystem",
    "Analyse-Tools für Persona-Interaktionsqualität"
  ],
  "notes": "Dieses Framework revolutioniert die Art und Weise, wie KI-Agenten interagieren, indem es menschliche Vielfalt und berufliche Spezialisierung simuliert. Es ermöglicht realistischere und nuanciertere Agenten-Interaktionen, besonders in komplexen Szenarien wie Projektmanagement, Beratung oder kreativen Prozessen.",
  "author": "jns",
  "open_questions": [
    "Wie werden Persona-Konflikte gelöst?",
    "Welche Persönlichkeitsmodelle sollen verwendet werden?",
    "Wie wird die Authentizität der Personas sichergestellt?",
    "Wie dynamisch können Personas angepasst werden?"
  ],
  "next_steps": [
    "Research bestehender Persona-Modelle (Big Five, MBTI etc.)",
    "Definition der Persona-Datenstruktur",
    "Implementierung des Persona-Engines",
    "Entwicklung der Kommunikations-Adaptionslogik",
    "Erstellung der Kompatibilitätsmatrix",
    "Integration mit bestehenden Agent-OS Systemen",
    "Test und Validierung der Persona-Interaktionen"
  ],
  "target_audience": "AI-Lab Framework Entwickler und Agenten-System Architekten",
  "benefits": [
    "Realistischere und nuanciertere Agenten-Interaktionen",
    "Bessere Anpassung an unterschiedliche Anwendungsfälle",
    "Erhöhte Akzeptanz durch menschenähnliches Verhalten",
    "Spezialisierte Expertensimulation durch Berufs-Personas",
    "Verbesserte Teamdynamik in Multi-Agenten-Systemen",
    "Flexiblere Einsatzmöglichkeiten in verschiedenen Domänen"
  ],
  "prerequisites": [
    "Agent-OS Basis-Framework",
    "KI-Tool Integration System",
    "Kommunikations-Interface für Agenten",
    "Datenbank für Persona-Profile"
  ]
}
