{
  "id": "IDEA-010",
  "title": "Agent-OS Quality Assurance Agent",
  "description": "Ein automatisierter Agent, der regelmäßig die Projekte im AI-Lab auf Vollständigkeit, Logikfehler, Standards-Compliance und Code-Qualität prüft und Berichte generiert.",
  "status": "backlog",
  "priority": "high",
  "category": "automation",
  "tags": [
    "agent-os",
    "quality-assurance",
    "automation",
    "monitoring"
  ],
  "created_date": "2025-11-09T06:14:13Z",
  "updated_date": "2025-11-09T06:14:13Z",
  "estimated_effort": "1-2 weeks",
  "dependencies": [
    "IDEA-006"
  ],
  "acceptance_criteria": [
    "Agent prüft automatisch alle Projekte im AI-Lab auf Vollständigkeit",
    "Agent erkennt Logikfehler und Inkonsistenzen in Projektdokumentationen",
    "Agent validiert Einhaltung der definierten Standards aus agent-os/",
    "Agent analysiert Code-Qualität und identifiziert schlechte Code-Praktiken",
    "Agent generiert regelmäßige QA-Berichte und Empfehlungen",
    "Agent kann automatisch Issues oder Work Items für gefundene Probleme erstellen",
    "Agent ist konfigurierbar für verschiedene Prüfintervalle und -tiefen"
  ],
  "notes": "Dieser Agent ist entscheidend für die Qualitätssicherung im AI-Lab und sollte früh implementiert werden. Er basiert auf den in agent-os/ definierten Standards und kann diese zur Validierung verwenden. Der Agent sollte verschiedene Prüfmodule haben: Vollständigkeitsprüfung, Logikprüfung, Standards-Compliance, Code-Qualität.",
  "author": "jns",
  "open_questions": [],
  "next_steps": [
    "Analyse bestehender agent-os/ Standards",
    "Definition der Prüfregeln und -kriterien",
    "Implementierung der Kern-Module",
    "Integration mit bestehenden Systemen",
    "Test und Pilotierung"
  ],
  "target_audience": "AI-Lab Framework Nutzer und Entwickler",
  "benefits": [
    "Deutliche Reduzierung manueller QA-Aufwände",
    "Frühzeitige Erkennung von Problemen",
    "Kontinuierliche Qualitätsverbesserung",
    "Standardisierung der Qualitätssicherung",
    "Transparente Nachverfolgung des Qualitätsstatus"
  ],
  "prerequisites": [
    "Agent-OS Standards",
    "Projekt-Management System",
    "Code-Analysis Tools"
  ]
}
